{
  "schemaVersion": "media.pdp0.quality-extension-provenance-successor-v3-independent-peer.v1",
  "reviewId": "AUD-SPEC-002",
  "candidate": {
    "ref": "docs/implementation/observations/pdp0-semantic-audit-slices/AUD-SPEC-002-quality-extension-source-candidate.v2.json",
    "sha256": "f6feb44574d87a7ee15807b80ac8cf8c95c9ca86ab81ff6c9cddea3ec5799a0a",
    "candidatePostimageSha256": "a7a292b33f1571a487bc2fa5b68ffcb636956a5096a3fa24247f21487eac62d4",
    "targetPostimages": [
      {
        "targetRef": ".product-experience/decision-log.md",
        "preimageSha256": "e1f5acd296785b8f820d6b3cdc1582842e6956831d3220d354e6c4ba1a2cc60d",
        "postimageSha256": "0d4c518af9ac6023475467f01711606ab9388ef34ac51b9bb47f917615c89298"
      },
      {
        "targetRef": ".product-experience/pdp-0-product-truth/quality-policy.yaml",
        "preimageSha256": "eb8751b7a8b84318a2ef37152a603d8256acf621a3265ce794757505d9fdaf3a",
        "postimageSha256": "39d66c0dd588bf177f29f721452d657b5f76aebe4b027ac69e3541ec29dade84"
      }
    ]
  },
  "provenanceSuccessor": {
    "ref": "docs/implementation/observations/pdp0-semantic-audit-slices/AUD-SPEC-002-quality-extension-source-candidate-v2-provenance-successor.v3.json",
    "sha256": "80aa263680242ffcf506e2f1f45c0a998fc844bad754ac64729c874b6b4f755a",
    "status": "METADATA_ONLY_SUCCESSOR_PENDING_ROOT_PROVENANCE_REVIEW",
    "predecessorRef": "docs/implementation/observations/pdp0-semantic-audit-slices/AUD-SPEC-002-quality-extension-source-candidate-v2-provenance-successor.v2.json",
    "predecessorSha256": "d87cbab2ca113c7f195330ea2564bc0cea2b00fff78f65d6f26ac66e6045448f"
  },
  "reviewer": {
    "identity": "agent:thread:01a16a35-bbcf-74d2-ac99-1ed74c29c3c9",
    "role": "DISTINCT_TECHNICAL_PEER",
    "candidateAuthor": "agent:/root/phase_io",
    "independentHumanReviewer": false,
    "credentialedAttestation": false
  },
  "scope": {
    "macroStage": "DISCOVERY",
    "phase": "PDP-0",
    "reviewType": "EXACT_CANDIDATE_AND_METADATA_PROVENANCE_PEER_REVIEW",
    "semanticScope": "UNCHANGED_TWO_TARGET_QUALITY_EXTENSION_CANDIDATE",
    "denominator": "ONE_FROZEN_CANDIDATE; NOT A FULL MEDIA SURFACE INVENTORY"
  },
  "disposition": "TECHNICAL_APPROVE_EXACT_CANDIDATE_ONLY",
  "findings": [],
  "verification": {
    "hashPinsMatched": true,
    "provenancePlannerSuite": {
      "command": "node --test tests/media-pdp0-quality-extension-provenance-plan-v3.test.mjs",
      "passed": 5,
      "failed": 0
    },
    "canonicalWrites": "NONE"
  },
  "authorityBoundary": {
    "sourceOwnerAdoption": "PENDING",
    "rootProvenanceReview": "PENDING",
    "canonicalApply": "NOT_PERFORMED",
    "sourceCurrentness": "NOT_CLAIMED",
    "phaseStatusEffect": "NONE",
    "independentAcceptance": "NOT_CLAIMED",
    "nativeProof": "NOT_CLAIMED"
  },
  "reviewBasis": {
    "sourceChoiceRef": "../ghatana-lifecycle/docs/engineering/reviews/gtool-critical-2026-10-23/media-aud-spec-002-quality-applicability-root-choice-r01.json",
    "sourceChoiceSha256": "f26831abe430b0f48b5f00e1fcde0ceca4ed70f6dcb109eecf8577d078589228",
    "priorV7PeerRef": "docs/implementation/observations/pdp0-semantic-audit-slices/AUD-SPEC-002-v7-quality-extension-independent-peer.v2.json",
    "priorV7PeerSha256": "fe1f0d98b7835f12a9aa7e31b511854ae0996e3242ed5866874b4d1cc7381db1",
    "semanticAssessment": "The frozen candidate binds the source-selected exact typed applicability option for media.recipe.specification.compile. It retains 462 historical quality rows, adds one current and six future rows, marks rights-safety applicable while other dimensions and all 16 metric rules are not applicable, and keeps measurement/qualification not evaluated, thresholds absent, and acceptance effect none. This review is limited to the exact source-definition candidate and metadata successor."
  }
}
